7540d75b-bd39-4019-a029-81b1c19a24ca	{"id":"7540d75b-bd39-4019-a029-81b1c19a24ca","title":"The Journal of ecclesiastical history.","alternativeTitles":[],"instanceTypeId":"2b94c631-fca9-a892-c730-03ee529ffe2c","source":"local","identifiers":[{"identifierTypeId":"8261054f-be78-422d-bd51-4ed9f33c3422","value":"8025698594"},{"identifierTypeId":"439bfbae-75bc-4f74-9fc7-b2a2d47ce3ef","value":"(CStRLIN)NYCX1604275S"},{"identifierTypeId":"439bfbae-75bc-4f74-9fc7-b2a2d47ce3ef","value":"(NIC)notisABP6388"},{"identifierTypeId":"439bfbae-75bc-4f74-9fc7-b2a2d47ce3ef","value":"366832"},{"identifierTypeId":"439bfbae-75bc-4f74-9fc7-b2a2d47ce3ef","value":"(OCoLC)1604275"},{"identifierTypeId":"913300b2-03ed-469a-8179-c1092c991227","value":"0022-0469"},{"identifierTypeId":"c858e4f2-2b6b-4385-842b-60732ee14abb","value":"58020553"}],"contributors":[{"name":"Dugmore, C. W.","contributorNameTypeId":"2b94c631-fca9-a892-c730-03ee529ffe2a"}],"publication":[{"publisher":"Cambridge University Press [etc.]","place":"London,"}],"classifications":[{"classificationTypeId":"6a52c832-0b53-4853-80f3-7bf945f0d669","classificationNumber":"BR140 .J6"}],"physicalDescriptions":["v. 25 cm."],"series":[],"urls":[],"languages":["eng"],"notes":[],"subjects":["Church history","Church history Periodicals","Periodicals"]}
4c5b502a-1c00-495b-81e1-f68670ee6b64	{"id":"4c5b502a-1c00-495b-81e1-f68670ee6b64","title":"Neue Ausgabe sämtlicher Werke, in Verbindung mit den Mozartstädten, Augsburg, Salzburg und Wien.","alternativeTitles":["Neue Mozart-Ausgabe"],"instanceTypeId":"2b94c631-fca9-a892-c730-03ee529ffe2c","source":"local","identifiers":[{"identifierTypeId":"8261054f-be78-422d-bd51-4ed9f33c3422","value":"8798381546"},{"identifierTypeId":"439bfbae-75bc-4f74-9fc7-b2a2d47ce3ef","value":"(OCoLC)63611770"},{"identifierTypeId":"439bfbae-75bc-4f74-9fc7-b2a2d47ce3ef","value":"393893"},{"identifierTypeId":"c858e4f2-2b6b-4385-842b-60732ee14abb","value":"55001156/M"}],"contributors":[{"name":"Mozart, Wolfgang Amadeus,","contributorNameTypeId":"2b94c631-fca9-a892-c730-03ee529ffe2a","primary":true}],"publication":[{"publisher":"Bärenreiter,","place":"Kassel,","dateOfPublication":"c1955-"}],"classifications":[{"classificationTypeId":"6a52c832-0b53-4853-80f3-7bf945f0d669","classificationNumber":"M3 .M896"}],"physicalDescriptions":["v. facsims. 33 cm."],"series":[],"urls":[],"languages":["lat"],"notes":[],"subjects":["Instrumental music","Vocal music"]}
c1f49141-d21d-45e9-a618-4aba09e8ff2c	{"id":"c1f49141-d21d-45e9-a618-4aba09e8ff2c","title":"The eighteenth century","alternativeTitles":["Eighteenth century collections"],"instanceTypeId":"2b94c631-fca9-a892-c730-03ee529ffe2c","source":"local","identifiers":[{"identifierTypeId":"8261054f-be78-422d-bd51-4ed9f33c3422","value":"4033529923"},{"identifierTypeId":"439bfbae-75bc-4f74-9fc7-b2a2d47ce3ef","value":"(OCoLC)9198532"},{"identifierTypeId":"439bfbae-75bc-4f74-9fc7-b2a2d47ce3ef","value":"(OCoLC)10110074"},{"identifierTypeId":"439bfbae-75bc-4f74-9fc7-b2a2d47ce3ef","value":"(OCoLC)10244202"},{"identifierTypeId":"439bfbae-75bc-4f74-9fc7-b2a2d47ce3ef","value":"(OCoLC)10783351"},{"identifierTypeId":"439bfbae-75bc-4f74-9fc7-b2a2d47ce3ef","value":"(OCoLC)13815315"},{"identifierTypeId":"439bfbae-75bc-4f74-9fc7-b2a2d47ce3ef","value":"(OCoLC)15380354"},{"identifierTypeId":"439bfbae-75bc-4f74-9fc7-b2a2d47ce3ef","value":"(OCoLC)19554478"},{"identifierTypeId":"439bfbae-75bc-4f74-9fc7-b2a2d47ce3ef","value":"(OCoLC)22099324"},{"identifierTypeId":"439bfbae-75bc-4f74-9fc7-b2a2d47ce3ef","value":"(OCoLC)22675561"},{"identifierTypeId":"439bfbae-75bc-4f74-9fc7-b2a2d47ce3ef","value":"(CStRLIN)NYCX83B57"},{"identifierTypeId":"439bfbae-75bc-4f74-9fc7-b2a2d47ce3ef","value":"(NIC)notisADJ8405"},{"identifierTypeId":"439bfbae-75bc-4f74-9fc7-b2a2d47ce3ef","value":"788038"},{"identifierTypeId":"c858e4f2-2b6b-4385-842b-60732ee14abb","value":"89894004"}],"contributors":[],"publication":[{"publisher":"Research Publications,","place":"Woodbridge, Conn. :","dateOfPublication":"[1982-"}],"classifications":[],"physicalDescriptions":["microfilm reels : illustrations ; 35 mm +"],"series":[],"urls":[],"languages":["eng"],"notes":["The guide, entitled The Eighteenth century : guide to the microfilm collection, is compiled annually for use in conjunction with those items released in the  corresponding calendar year: it supersedes the temporary guides which accompany each 35-reel unit of microfilm. There are listings by main entry (usually author), title and subject (each title is entered under one of eight general subject areas). Gives reel and location numbers for each item. The preliminary frames of each reel list sequentially the items contained on it.Reels <3711-> issued by Primary Source Microfilm."],"subjects":["1700 - 1799","Civilization","Eighteenth century","English literature","English literature 18th century","Great Britain","Great Britain Civilization 18th century","Great Britain History 18th century","History"]}
1499ddc7-74f0-4e76-824a-5449e2d159f6	{"id":"1499ddc7-74f0-4e76-824a-5449e2d159f6","title":"The Law of Federal income taxation.","alternativeTitles":["Mertens the law of federal income taxationMertens law of federal income taxation"],"instanceTypeId":"2b94c631-fca9-a892-c730-03ee529ffe2c","source":"local","identifiers":[{"identifierTypeId":"8261054f-be78-422d-bd51-4ed9f33c3422","value":"1641629454"},{"identifierTypeId":"439bfbae-75bc-4f74-9fc7-b2a2d47ce3ef","value":"(OCoLC)10724092"},{"identifierTypeId":"439bfbae-75bc-4f74-9fc7-b2a2d47ce3ef","value":"(NIC)notisAHJ5096"},{"identifierTypeId":"439bfbae-75bc-4f74-9fc7-b2a2d47ce3ef","value":"1567726"},{"identifierTypeId":"c858e4f2-2b6b-4385-842b-60732ee14abb","value":"42022330"}],"contributors":[{"name":"Mertens, Jacob,","contributorNameTypeId":"2b94c631-fca9-a892-c730-03ee529ffe2a"}],"publication":[{"publisher":"West Group,","place":"[St. Paul] :","dateOfPublication":"1942-"}],"classifications":[{"classificationTypeId":"6a52c832-0b53-4853-80f3-7bf945f0d669","classificationNumber":"KF6365 .M4"}],"physicalDescriptions":["v. (loose-leaf) 26 cm."],"series":[],"urls":[],"languages":["eng"],"notes":["Some volumes have title: Mertens law of federal income taxation; Mertens the law of federal income taxation.Originally issued in bound format and kept up to date by pocket supplements and revised volumes.Published in Chicago, Ill. and Wilmette, Ill. by Callaghan (1942-1991); Deerfield, IL : Clark Boardman Callaghan (1991-1997).The service is divided into five parts: Treatise, by Jacob Mertens, Jr. and others (loose-leaf); Code, current volume (loose-leaf) and bound volumes, 1954-1958-- ; Code commentary (loose-leaf); Regulations, 1954-1982 (bound volumes), 1983-1984 (loose-leaf) ; Rulings, current volume (loose-leaf) and bound volumes, 1954-1957--Includes unnumbered volumes: Tables, Table of cases, Regulations preambles, Proposed regulations preambles, Current materials, Index, and Rulings.'Current tax highlights' are periodically transferred from section 3 of the Current materials volume to unnumbered Highlights volume.Includes separately numbered Regulations volumes (1985- ). Regulations volumes continued by Mertens federal tax regulations which consists of: regulations issued annually in softbound format; Regulations preambles; Proposed regulations preambles; Current developments and status table.Includes 'Complete internal revenue code' issued as soft-bound supplement.Description based on: T.p., 1997-1998 rulings."],"subjects":["Income tax Law and legislation","Income tax Law and legislation United States","United States"]}
410e047e-996e-4921-b3c2-ec547da7e14e	{"id":"410e047e-996e-4921-b3c2-ec547da7e14e","title":"Purdon's Pennsylvania statutes, annotated : permanent ed.","alternativeTitles":[],"instanceTypeId":"2b94c631-fca9-a892-c730-03ee529ffe2c","source":"local","identifiers":[{"identifierTypeId":"8261054f-be78-422d-bd51-4ed9f33c3422","value":"961915195"},{"identifierTypeId":"439bfbae-75bc-4f74-9fc7-b2a2d47ce3ef","value":"(NIC)notisAHK7689"},{"identifierTypeId":"439bfbae-75bc-4f74-9fc7-b2a2d47ce3ef","value":"(OCoLC)3289989"},{"identifierTypeId":"439bfbae-75bc-4f74-9fc7-b2a2d47ce3ef","value":"1579067"},{"identifierTypeId":"c858e4f2-2b6b-4385-842b-60732ee14abb","value":"30014365 //r855"}],"contributors":[{"name":"Purdon, John,","contributorNameTypeId":"2b94c631-fca9-a892-c730-03ee529ffe2a"}],"publication":[{"publisher":"George T. Bisel Co. ; West Publishing Co.,","place":"Philadelphia, Pa. : St. Paul, Minn. :","dateOfPublication":"1930-"}],"classifications":[{"classificationTypeId":"6a52c832-0b53-4853-80f3-7bf945f0d669","classificationNumber":"KFP30 1930 .A44"}],"physicalDescriptions":["v. ; 25 cm."],"series":[],"urls":[],"languages":["eng"],"notes":["Includes unnumbered tables and index volumes.Kept up to date by pocket parts, supplementary pamphlets, interim annotation service, bound supplements, Purdon's Pennsylvania legislative service, and replacement volumes with title: Purdon's Pennsylvania consolidated statutes, annotated ; Purdon's Pennsylvania statutes and consolidated statutes annotated.Vols. for  published by West Group."],"subjects":["Law","Law Pennsylvania","Pennsylvania"]}
ad26bbeb-e4ec-4d44-9b33-cd8da096db5e	{"id":"ad26bbeb-e4ec-4d44-9b33-cd8da096db5e","title":"Mistapim in Cambodia","alternativeTitles":[],"instanceTypeId":"2b94c631-fca9-a892-c730-03ee529ffe2c","source":"local","identifiers":[{"identifierTypeId":"8261054f-be78-422d-bd51-4ed9f33c3422","value":"6210580686"},{"identifierTypeId":"439bfbae-75bc-4f74-9fc7-b2a2d47ce3ef","value":"(CStRLIN)NYCX89B13682"},{"identifierTypeId":"439bfbae-75bc-4f74-9fc7-b2a2d47ce3ef","value":"(NIC)notisAJC6081"},{"identifierTypeId":"439bfbae-75bc-4f74-9fc7-b2a2d47ce3ef","value":"(OCoLC)20036158"},{"identifierTypeId":"439bfbae-75bc-4f74-9fc7-b2a2d47ce3ef","value":"1735560"}],"contributors":[{"name":"Pym, Christopher,","contributorNameTypeId":"2b94c631-fca9-a892-c730-03ee529ffe2a","primary":true}],"publication":[{"publisher":"Hodder & Stoughton","place":"London,","dateOfPublication":"[1960]"}],"classifications":[],"physicalDescriptions":["vii, 192 p. illus., map. 21 cm."],"series":[],"urls":[],"languages":["eng"],"notes":[],"subjects":["Cambodia","Cambodia Description and travel","Travel"]}
6d6377d8-0a13-4dca-910b-42bdf2f61807	{"id":"6d6377d8-0a13-4dca-910b-42bdf2f61807","title":"Ancient voices of children; [a cycle of songs on texts by García Lorca] for soprano, boy soprano, oboe, mandolin, harp, electric piano [and] percussion.","alternativeTitles":[],"instanceTypeId":"2b94c631-fca9-a892-c730-03ee529ffe2c","source":"local","identifiers":[{"identifierTypeId":"8261054f-be78-422d-bd51-4ed9f33c3422","value":"8582839901"},{"identifierTypeId":"439bfbae-75bc-4f74-9fc7-b2a2d47ce3ef","value":"(CStRLIN)NYCX91C2172"},{"identifierTypeId":"439bfbae-75bc-4f74-9fc7-b2a2d47ce3ef","value":"(NIC)notisAJX6816"},{"identifierTypeId":"439bfbae-75bc-4f74-9fc7-b2a2d47ce3ef","value":"(OCoLC)526872"},{"identifierTypeId":"439bfbae-75bc-4f74-9fc7-b2a2d47ce3ef","value":"1913668"},{"identifierTypeId":"c858e4f2-2b6b-4385-842b-60732ee14abb","value":"72209620 /M"}],"contributors":[{"name":"Crumb, George.","contributorNameTypeId":"2b94c631-fca9-a892-c730-03ee529ffe2a","primary":true},{"name":"García Lorca, Federico,","contributorNameTypeId":"2b94c631-fca9-a892-c730-03ee529ffe2a"},{"name":"García Lorca, Federico,","contributorNameTypeId":"2b94c631-fca9-a892-c730-03ee529ffe2a"},{"name":"García Lorca, Federico,","contributorNameTypeId":"2b94c631-fca9-a892-c730-03ee529ffe2a"}],"publication":[{"publisher":"C. F. Peters Corp.","place":"New York,","dateOfPublication":"[c1970]"}],"classifications":[{"classificationTypeId":"6a52c832-0b53-4853-80f3-7bf945f0d669","classificationNumber":"M1613.3.C92 A5 M1528 M1619.5.G33 ML96.5.C865"}],"physicalDescriptions":["score (8 p.) 52 cm."],"series":[],"urls":[],"languages":["eng"],"notes":["Spanish words; text with English translation included preceding the score.Duration: about 27 min.Reproduced from holograph."],"subjects":["García Lorca, Federico, 1898-1936","García Lorca, Federico, 1898-1936 Musical settings","Musical settings","Song cycles","Songs (High voice) with instrumental ensemble Scores","Vocal duets with instrumental ensemble Scores"]}
3a92e964-564c-4a32-8fb7-50645b19caf0	{"id":"3a92e964-564c-4a32-8fb7-50645b19caf0","title":"Cornell University Graduate School records,","alternativeTitles":[],"instanceTypeId":"2b94c631-fca9-a892-c730-03ee529ffe2c","source":"local","identifiers":[{"identifierTypeId":"8261054f-be78-422d-bd51-4ed9f33c3422","value":"4020574463"},{"identifierTypeId":"439bfbae-75bc-4f74-9fc7-b2a2d47ce3ef","value":"(CStRLIN)NYCV84A1595"},{"identifierTypeId":"439bfbae-75bc-4f74-9fc7-b2a2d47ce3ef","value":"(CStRLIN)NYCV84-A1595"},{"identifierTypeId":"439bfbae-75bc-4f74-9fc7-b2a2d47ce3ef","value":"(OCoLC)64073323"},{"identifierTypeId":"439bfbae-75bc-4f74-9fc7-b2a2d47ce3ef","value":"2074805"}],"contributors":[],"publication":[],"classifications":[],"physicalDescriptions":["8 volumes; 29.3 cubic ft."],"series":[],"urls":["http://resolver.library.cornell.edu/cgi-bin/EADresolver?id=RMA01776"],"languages":["eng"],"notes":[],"subjects":["Cornell University","Cornell University Administration","Management"]}
e27de3c1-17d1-4874-ac27-19f9cea8317a	{"id":"e27de3c1-17d1-4874-ac27-19f9cea8317a","title":"Balinese transcripts,","alternativeTitles":[],"instanceTypeId":"2b94c631-fca9-a892-c730-03ee529ffe2c","source":"local","identifiers":[{"identifierTypeId":"8261054f-be78-422d-bd51-4ed9f33c3422","value":"3201989242"},{"identifierTypeId":"439bfbae-75bc-4f74-9fc7-b2a2d47ce3ef","value":"(CStRLIN)NYCV88A235"},{"identifierTypeId":"439bfbae-75bc-4f74-9fc7-b2a2d47ce3ef","value":"(CStRLIN)NYCV88-A235"},{"identifierTypeId":"439bfbae-75bc-4f74-9fc7-b2a2d47ce3ef","value":"(NIC)notisAKS5183"},{"identifierTypeId":"439bfbae-75bc-4f74-9fc7-b2a2d47ce3ef","value":"(OCoLC)63934641"},{"identifierTypeId":"439bfbae-75bc-4f74-9fc7-b2a2d47ce3ef","value":"2087008"}],"contributors":[],"publication":[],"classifications":[],"physicalDescriptions":["36 cubic ft."],"series":[],"urls":["http://resolver.library.cornell.edu/cgi-bin/EADresolver?id=RMM04354"],"languages":["map"],"notes":["Cornell's holdings may number up to 3676 items, if the Echols Collection actually received all of the transcriptions that should have been sent.  An 'item' refers to a discrete text ranging in length from one to over one hundred pages.  Items are consecutively numbered.  Information concerning the transcriptions' titles and number of pages appears on eighty shipping lists."],"subjects":["Bali Island (Indonesia) Religious life and customs","Balinese literature","Ethics, Balinese","Hindu law","Hindu legends","Hindu literature","Hinduism","Hinduism Bali Island (Indonesia)","Indonesia Bali Island","Manuscripts, Balinese","Mythology, Balinese"]}
